"","Y","id","Organization.Name","Industries","Headquarters.Location","Description","CB.Rank..Company.","Estimated.Revenue.Range","Founded.Date","Founded.Date.Precision","Industry.Groups","Number.of.Founders","Number.of.Employees","Number.of.Funding.Rounds","Total.Funding.Amount","Number.of.Investors","IPO.Status","IPO.Date","Acquisition.Status","Number.of.Events","Number.of.Lead.Investors","Funding.Status","Last.Funding.Date","Last.Funding.Amount.Currency..in.USD.","Last.Funding.Type","IPqwery...Total.Patents","IPqwery...Total.Trademarks","Investment.Stage"
"241",1,241,"Stem Disintermedia","Accounting, FinTech, Music, Video","Los Angeles, California, United States","Stem Disintermedia helps creators, artists, and musicians to collect digital revenue and enables them to track and share their earnings.",5480,"NA","2/13/2015","day","Financial Services, Media and Entertainment, Music and Audio, Professional Services, Video","3","11-50",5,12500000,"27","Private","NA","NA","NA","3","Early Stage Venture","11/26/2018","NA","Convertible Note","0","1","NA"
"1713",0,1713,"Boost Mobile","Electronics, Mobile, Telecommunications","Irvine, California, United States","Boost Mobile offers wireless phones and services with no long-term contracts.",42146,"NA","1/1/2000","year","Consumer Electronics, Hardware, Mobile","3","251-500",NA,NA,"NA","Private","NA","NA","NA","NA","NA",NA,"NA","NA","NA","NA","NA"
"1879",0,1879,"BioflightVR","Education, Simulation, Virtual Reality","Santa Monica, California, United States","BioflightVR team of passionate doctors, content developers and programmers dedicated to advancing immersive medical platforms.",46459,"NA","12/5/2015","day","Education, Hardware, Software","3","1-10",2,250000,"NA","Private","NA","NA","1","NA","Seed","1/31/2019","NA","Seed","NA","NA","NA"
"1054",0,1054,"Novus Therapeutics, Inc.","Biotechnology, Medical, Pharmaceutical","Irvine, California, United States","Pharmaceutical company focusing on development of ear, nose, and throat (ENT) products",24591,"$100M to $500M","1/1/2004","year","Biotechnology, Health Care, Science and Engineering","1","11-50",5,124764000,"7","Public","2014-09-26","Made Acquisitions","NA","2","IPO","5/15/2013","35500000","Series E","1","4","NA"
"1408",0,1408,"Amplify Surgical Inc.","Health Care, Manufacturing, Medical Device","Mission Viejo, California, United States","Amplify Surgical manufactures, and markets spinal implant devices.",34138,"NA","1/1/2017","year","Health Care, Manufacturing","1","1-10",1,7300000,"NA","Private","NA","NA","NA","NA","Early Stage Venture","10/3/2018","7300000","Series A","0","1","NA"
"1438",0,1438,"Emerald Bioscience","Biopharma, Biotechnology, Pharmaceutical","Long Beach, California, United States","Emerald Bioscience is a biopharmaceutical company focused on the discovery, development, and the commercialization.",34800,"NA","1/1/2011","year","Biotechnology, Health Care, Science and Engineering","1","1-10",6,29835989,"3","Public","2014-12-01","NA","NA","2","IPO","11/14/2017","2000000","Post-IPO Equity","NA","NA","NA"
"140",1,140,"Alpha Foods","Food and Beverage, Food Processing, Nutrition, Sustainability","Glendale, California, United States","Alpha Foods produces plant-based foods focused on taste, texture, and sustainability.",3077,"$10M to $50M","1/1/2015","year","Food and Beverage, Health Care, Sustainability","2","1-10",2,3.5e+07,"4","Private","NA","NA","NA","2","Early Stage Venture","2/11/2020","28000000","Series A","0","2","NA"
"1618",0,1618,"Forever 21","E-Commerce, Fashion, Retail","Los Angeles, California, United States","Forever 21 operates as a clothing retailer company.",39658,"NA","4/21/1984","day","Clothing and Apparel, Commerce and Shopping, Design","1","10001+",1,NA,"1","Private","NA","NA","NA","NA","NA","2/19/2020","NA","Corporate Round","3","94","NA"
"107",1,107,"The Bouqs Company","Delivery, E-Commerce, Retail","Los Angeles, California, United States","The Bouqs Company is a cut-to-order online flower delivery service.",2380,"$1M to $10M","11/1/2012","day","Administrative Services, Commerce and Shopping","2","51-100",7,73100000,"28","Private","NA","NA","2","3","Late Stage Venture","1/30/2020","30000000","Series D","0","6","NA"
"1479",0,1479,"AKA","Artificial Intelligence, Robotics","Santa Monica, California, United States","AKA is developing A.I. engines and robots to help improve communication among objects.",35659,"NA","9/1/2009","month","Artificial Intelligence, Data and Analytics, Hardware, Science and Engineering, Software","1","11-50",4,10801200,"8","Private","NA","NA","1","NA","Early Stage Venture","8/31/2016","4400000","Convertible Note","NA","NA","NA"
"1607",0,1607,"Carenote","Android, Apps, Information Technology, Messaging, Mobile, Telecommunications","Santa Monica, California, United States","At Carenote, we provide a companionship service through check-ins and conversations via mobile phone, chat and text/SMS.",39256,"NA","1/1/2018","year","Apps, Hardware, Information Technology, Internet Services, Messaging and Telecommunications, Mobile, Platforms, Software","2","1-10",1,2500000,"1","Private","NA","NA","NA","NA","Seed","11/13/2018","2500000","Seed","NA","NA","NA"
"186",1,186,"Flo Technologies","Hardware, Internet of Things, Security, Smart Building, Smart Home, Software, Water","Culver City, California, United States","Flo prevents water damage and unnecessary water waste in homes with its Flo by Moen smart home water monitoring and leak protection system.",4270,"$1M to $10M","4/1/2015","month","Consumer Electronics, Hardware, Internet Services, Natural Resources, Privacy and Security, Real Estate, Software","2","11-50",3,39250000,"9","Private","NA","NA","6","1","Early Stage Venture","1/3/2019","28000000","Series B","9","24","NA"
"710",0,710,"kenshō","Health Care, Internet","Venice, California, United States","Kenshō is the first personalized research-backed holistic health discovery platform.",16066,"NA","1/1/2017","year","Health Care, Internet Services","2","NA",1,1300000,"2","Private","NA","NA","NA","2","Seed","10/4/2019","1300000","Pre-Seed","NA","NA","NA"
"1808",0,1808,"Cloud Spot","E-Commerce, Mobile, Photo Sharing, Photography, SaaS","Orange, California, United States","Cloud Spot was created to be the fastest and most customizable way for professional photographers to deliver, share, and sell their work.",44741,"$1M to $10M","3/1/2015","day","Commerce and Shopping, Content and Publishing, Media and Entertainment, Mobile, Software","1","1-10",3,4e+05,"2","Private","NA","NA","NA","1","Seed","12/16/2016","400000","Seed","NA","NA","NA"
"444",1,444,"Cedars Sinai Medical Center","Communities, Health Care, Medical, Non Profit","Los Angeles, California, United States","Cedars-Sinai is a non-profit, academic, community-centric medical center in Los Angeles, California.",9737,"$1M to $10M","1/1/1902","year","Community and Lifestyle, Health Care","1","11-50",3,28300000,"2","Private","NA","NA","1","2","NA","1/4/2020","1000000","Grant","433","34","NA"
"295",1,295,"Frequency","Apps, Mobile, Social Media, Video","Los Angeles, California, United States","Frequency is a cloud-based internet video service that aggregates and distributes videos from the content producers.",6658,"NA","1/1/2010","year","Apps, Internet Services, Media and Entertainment, Mobile, Software, Video","1","11-50",3,1.4e+07,"4","Private","NA","NA","NA","NA","Early Stage Venture","6/8/2016","11000000","Series B","10","2","NA"
"1610",0,1610,"7 Generation Games","Apps, Education, Gaming, Parenting, Video Games","Santa Monica, California, United States","7 Generation Games makes immersive video games and interactive apps that teach math – in English and Spanish.    ",39326,"$1M to $10M","1/1/2012","year","Apps, Community and Lifestyle, Education, Gaming, Software","3","1-10",10,2395000,"3","Private","NA","NA","NA","NA","Seed","10/15/2018","15000","Grant","0","1","NA"
"1797",0,1797,"Vessix Vascular","Health Care, Health Diagnostics, Medical Device","Laguna Hills, California, United States","Vessix Vascular is a pre-revenue stage company developing novel radiofrequency balloon catheter technology.",44510,"NA","1/1/2003","year","Health Care","1","11-50",2,27700000,"4","Private","NA","Was Acquired","NA","2","M&A","8/3/2011","23000000","Series B","26","5","NA"
"1964",0,1964,"Skyline Financial","Banking, Finance, Financial Services, Real Estate, Venture Capital","Agoura Hills, California, United States","Skyline Financial focuses on streamlining the process by which loans are originated and funded.",48764,"$10M to $50M","1/1/1985","year","Financial Services, Lending and Investments, Real Estate","NA","501-1000",1,8200000,"1","Private","NA","NA","NA","1","NA","10/11/2010","8200000","Venture - Series Unknown","0","3","NA"
"1631",0,1631,"Kelley Blue Book","Automotive","Irvine, California, United States","Kelley Blue Book provides The Trusted Resource® which provides vehicle buyers and sellers with information on new and used-vehicles.",39975,"NA","1/1/1926","year","Transportation","NA","251-500",NA,NA,"NA","Private","NA","Made Acquisitions, Was Acquired","1","NA","M&A",NA,"NA","NA","NA","NA","NA"
"762",0,762,"Vezt","Music","Los Angeles, California, United States","Founded in 2016 and headquartered in Los Angeles, Vezt lets music fans share ownership with artists in their favorite songs.",17463,"NA","1/1/2016","year","Media and Entertainment, Music and Audio","2","11-50",2,2425000,"2","Private","NA","NA","2","1","Seed","8/28/2019","2100000","Seed","0","4","NA"
"46",1,46,"Flowspace","Logistics, Supply Chain Management, Warehousing","Los Angeles, California, United States","Flowspace is the Largest On-Demand Warehousing and Fulfillment Network",959,"Less than $1M","1/1/2017","year","Transportation","2","51-100",4,15520000,"6","Private","NA","NA","1","2","Early Stage Venture","4/16/2019","12000000","Series A","0","1","NA"
"1154",0,1154,"Labrador Systems","Information Technology, Robotics, Software","Oak Park, California, United States","Labrador is a robotics company building a new generation of assistive robots to improve the quality of life for millions of people.",27290,"NA","7/17/2017","day","Hardware, Information Technology, Science and Engineering, Software","2","1-10",1,2e+06,"5","Private","NA","NA","NA","1","Seed","9/24/2019","2000000","Pre-Seed","0","1","NA"
"654",0,654,"Karem Aircraft","Aerospace, Air Transportation, Industrial Manufacturing","Lake Forest, California, United States","Karem Aircraft is an aviation and aerospace company that provides aircraft systems and subsystems.",14580,"$1M to $10M","1/1/2004","year","Manufacturing, Science and Engineering, Transportation","1","101-250",1,2.5e+07,"1","Private","NA","NA","NA","1","Early Stage Venture","7/17/2019","25000000","Series A","17","0","NA"
"199",1,199,"Securonix","Cyber Security","Los Angeles, California, United States","Securonix delivers a  security analytics and operations management platform for the modern era of big data and advanced cyber threats.",4504,"$50M to $100M","1/1/2008","year","Information Technology, Privacy and Security","2","251-500",1,2.9e+07,"2","Private","NA","NA","28","1","Early Stage Venture","9/20/2017","29000000","Series A","2","0","NA"
"1647",0,1647,"TallyGo","Android, Apps, iOS, Mapping Services, Navigation, SaaS","Venice, California, United States","The World's First Navigation as a Service",40374,"$1M to $10M","9/1/2014","day","Apps, Mobile, Navigation and Mapping, Platforms, Software","1","11-50",2,1e+06,"3","Private","NA","NA","1","NA","NA","9/1/2016","NA","Venture - Series Unknown","0","3","NA"
"52",1,52,"Talespin","Artificial Intelligence, Augmented Reality, Corporate Training, Enterprise Software, Software, Training, Virtual Reality","Culver City, California, United States","Talespin creates enterprise XR (virtual, augmented, and mixed reality) workforce transformation solutions.",1126,"$1M to $10M","1/1/2015","year","Artificial Intelligence, Data and Analytics, Education, Hardware, Science and Engineering, Software","2","51-100",3,20595000,"3","Private","NA","Made Acquisitions","1","1","Early Stage Venture","3/3/2020","15000000","Series B","0","1","NA"
"711",0,711,"MiTu Network","Digital Media, Direct Marketing, Lifestyle","Santa Monica, California, United States","MiTú is a Latino lifestyle network focused on health, beauty, food, family, home, and pop culture.",16085,"NA","4/1/2012","day","Community and Lifestyle, Media and Entertainment, Sales and Marketing","3","11-50",3,1.8e+07,"7","Private","NA","NA","NA","1","Early Stage Venture","2/4/2015","5000000","Series B","NA","NA","NA"
"414",1,414,"Ready, Set, Food!","E-Commerce, Food and Beverage, Health Care","Los Angeles, California, United States","Ready, Set, Food! develops an evidence-based solution that makes it easy for parents to protect their babies from common food allergies.",9185,"NA","1/1/2017","year","Commerce and Shopping, Food and Beverage, Health Care","2","1-10",3,2550000,"9","Private","NA","NA","NA","2","Seed","1/20/2020","350000","Seed","1","1","NA"
"1303",0,1303,"Pledgeling","Internet, Mobile, Non Profit","Venice, California, United States","We empower brands, organizations and individuals to do good. #PledgeToDoGood",31109,"NA","11/1/2014","day","Internet Services, Mobile","2","11-50",2,4e+06,"5","Private","NA","NA","NA","NA","Seed","2/8/2018","NA","Seed","0","3","NA"
"639",0,639,"Finli","Financial Services","Los Angeles, California, United States","Finli is an enterprise payment platform for the neighborhood business",14330,"NA","1/1/2019","year","Financial Services","1","1-10",1,2e+06,"6","Private","NA","NA","NA","NA","Seed","11/1/2019","2000000","Seed","0","1","NA"
"1711",0,1711,"ONDA Life","Hospitality, Service Industry, Wellness","Los Angeles, California, United States","ONDA Life is a community platform connecting people, places and projects with purpose.",42129,"NA","1/1/2018","year","Health Care, Travel and Tourism","1","1-10",1,1e+06,"NA","Private","NA","NA","NA","NA","Seed","7/5/2018","1000000","Seed","NA","NA","NA"
"1684",0,1684,"Kuona","Analytics, Artificial Intelligence, Consumer Goods, E-Commerce, Machine Learning, Mobile","Los Angeles, California, United States","Machine learning to optimize pricing & inventories for Consumer product companies and Retailers",41122,"NA","1/1/2013","year","Artificial Intelligence, Commerce and Shopping, Consumer Goods, Data and Analytics, Mobile, Science and Engineering, Software","2","11-50",5,650000,"6","Private","NA","NA","NA","1","Seed","8/20/2018","NA","Seed","NA","NA","NA"
"791",0,791,"Basepaws","Biotechnology, Consumer, Pet","El Segundo, California, United States","Pet genetics & health monitoring.",18403,"Less than $1M","1/1/2016","year","Biotechnology, Community and Lifestyle, Science and Engineering","3","1-10",4,251000,"3","Private","NA","NA","NA","NA","Seed","1/5/2020","NA","Seed","0","1","NA"
"226",1,226,"ResortPass","Hospitality, Internet, Leisure, Travel","Santa Monica, California, United States","ResortPass is an online booking platform for access to resorts and hotels for the pool, spa, fitness, and amenities.",5224,"NA","1/1/2016","year","Community and Lifestyle, Internet Services, Travel and Tourism","2","11-50",3,11700000,"12","Private","NA","NA","NA","1","Early Stage Venture","8/19/2019","9000000","Series A","0","1","NA"
"868",0,868,"VYRL","Big Data, Digital Marketing, E-Commerce, Marketing Automation, Social Media Marketing","Irvine, California, United States","VYRL is building the biggest E-commerce Network in the world.",20250,"NA","10/15/2015","day","Commerce and Shopping, Data and Analytics, Sales and Marketing, Software","2","11-50",3,3065000,"7","Private","NA","NA","NA","2","Early Stage Venture","6/1/2019","NA","Series A","0","9","NA"
"1196",0,1196,"LeggUP Inc.","Career Planning, Corporate Training, EdTech, Employee Benefits, Human Resources, InsurTech","Newport Beach, California, United States","Professional Development HR Solution",28453,"NA","7/14/2017","day","Education, Financial Services, Health Care, Professional Services, Software","2","1-10",1,2e+06,"1","Private","NA","NA","NA","1","Seed","11/21/2019","2000000","Seed","0","3","NA"
"927",0,927,"Discotech","Android, Hospitality, iOS, Lifestyle, Nightlife, Travel","Los Angeles, California, United States","Top-rated nightlife app that allows users to browse and book table service, purchase presale tickets, and sign up for guest lists.",21899,"Less than $1M","1/1/2012","year","Community and Lifestyle, Events, Media and Entertainment, Mobile, Platforms, Software, Travel and Tourism","5","1-10",5,5e+05,"6","Private","NA","NA","NA","NA","NA","2/1/2017","NA","Venture - Series Unknown","0","1","NA"
"441",1,441,"Mobilitie","Infrastructure, Mobile, Wireless","Newport Beach, California, United States","Mobilitie develops and operates networks and infrastructure that wireless carriers rely upon to provide coverage for their customers.",9637,"$100M to $500M","1/1/2005","year","Hardware, Mobile","1","501-1000",2,4.25e+08,"3","Private","NA","NA","4","2","Private Equity","11/10/2015","325000000","Debt Financing","48","50","NA"
"1034",0,1034,"Netki","Computer, Privacy, Security","Canoga Park, California, United States","The leading provider of tools to foster the adoption of blockchain technology.",24250,"NA","7/14/2014","day","Consumer Electronics, Hardware, Privacy and Security","2","1-10",2,3500000,"12","Private","NA","NA","11","1","Seed","5/3/2018","NA","Convertible Note","0","2","NA"
"1835",0,1835,"Bidderlo","E-Commerce, Internet","Los Angeles, California, United States","Bidderlo is an e-commerce online auction site that uses new technology to bid on trending items",45464,"NA","1/1/2018","year","Commerce and Shopping, Internet Services","NA","501-1000",1,1e+06,"1","Private","NA","NA","NA","NA","Early Stage Venture","2/1/2019","1000000","Series A","NA","NA","NA"
"1860",0,1860,"Mobile Motion","Information Technology, Internet, Photography, Software","Woodland Hills, California, United States","Mobile Motion is providing helping ordinary people to connect with the internet.",46100,"Less than $1M","3/1/2013","day","Content and Publishing, Information Technology, Internet Services, Media and Entertainment, Software","1","1-10",1,5238521,"1","Private","NA","NA","NA","1","Early Stage Venture","7/28/2015","5238521","Series A","NA","NA","NA"
"163",1,163,"Herbalife Nutrition Ltd.","Direct Sales, Fitness, Health Care, Nutrition, Wellness","Los Angeles, California, United States","Herbalife is a global nutrition company that has helped people pursue healthy.",3676,"$1B to $10B","1/1/1980","year","Food and Beverage, Health Care, Sales and Marketing, Sports","1","5001-10000",1,1.45e+09,"2","Public","2004-12-23","Made Acquisitions","NA","2","IPO","2/15/2017","1450000000","Post-IPO Debt","NA","NA","NA"
"1254",0,1254,"Eccentex Corporation","Cloud Computing, Enterprise Software, SaaS, Software","Culver City, California, United States","Eccentex delivers case management solutions through AppBase, its Dynamic Case Management (DCM) Platform-as-a-Service (PaaS) application.",29773,"$1M to $10M","1/1/2008","year","Internet Services, Software","2","51-100",1,8100000,"1","Private","NA","NA","NA","NA","Private Equity","3/2/2012","8100000","Private Equity","0","5","NA"
"1285",0,1285,"ECFX","Legal Tech, Software","Venice, California, United States","Intelligent Automation of Electronic Court Notices",30677,"NA","1/23/2019","day","Professional Services, Software","3","1-10",1,1500000,"NA","Private","NA","NA","1","NA","NA","3/15/2019","1500000","Debt Financing","0","3","NA"
"488",0,488,"Hippeas","Food and Beverage, Health Care, Organic Food","Los Angeles, California, United States","Hippeas is a operator of natural snack food companies.",10822,"$1M to $10M","1/1/2015","year","Food and Beverage, Health Care","1","11-50",4,2.2e+07,"3","Private","NA","NA","NA","2","NA","12/7/2018","8000000","Venture - Series Unknown","NA","NA","NA"
"1043",0,1043,"ENDALGO","Communities, Sports","Los Angeles, California, United States","Find soccer near you | ENDALGO is a soccer community platform that provides all the real-time soccer information in your area.",24388,"NA","10/4/2016","day","Community and Lifestyle, Sports","2","11-50",3,4300000,"NA","Private","NA","NA","NA","NA","Seed","7/10/2018","3000000","Seed","NA","NA","NA"
"815",0,815,"RevolutionCredit","Consumer, Credit, Finance","Irvine, California, United States","RevolutionCredit is an engagement platform that helps lenders and consumers with the credit decisioning process.",18842,"NA","1/1/2012","year","Financial Services, Lending and Investments","1","11-50",1,9655354,"12","Private","NA","NA","1","1","Seed","8/25/2017","9655354","Seed","0","8","NA"
"117",1,117,"Fuel50","Career Planning, Cloud Computing, Employee Benefits, Employment, Human Resources, Recruiting, SaaS, Software, Training","Laguna Niguel, California, United States","Fuel50 increases employee engagement and retention with gamified career growth tools for career visibility, leader coaching, and more.",2644,"$1M to $10M","1/1/2013","year","Education, Health Care, Internet Services, Professional Services, Software","2","11-50",7,20627957,"4","Private","NA","NA","NA","3","Early Stage Venture","8/1/2019","14000000","Series B","NA","NA","NA"
"469",0,469,"Solaborate","Information Technology, Private Social Networking, Social Media, Software","Los Angeles, California, United States","Solaborate, is all in one  communication  and collaboration platform company",10421,"NA","6/1/2012","day","Community and Lifestyle, Information Technology, Internet Services, Media and Entertainment, Software","2","51-100",3,11430000,"2","Private","NA","NA","5","NA","Early Stage Venture","2/3/2020","10000000","Series A","1","0","NA"
"406",1,406,"SetSchedule","Big Data, Marketing Automation, Mobile Apps, Real Estate, SaaS","Irvine, California, United States","SetSchedule is a technology innovator revolutionizing the real estate space by using its AI-powered predictive data marketplace.",8992,"Less than $1M","1/1/2014","year","Apps, Data and Analytics, Mobile, Real Estate, Sales and Marketing, Software","2","101-250",4,3400000,"NA","Private","NA","NA","NA","NA","Early Stage Venture","12/6/2017","2000000","Series A","0","2","NA"
"693",0,693,"Socialive","Marketing, SaaS, Software, Video, Video Streaming","El Segundo, California, United States","Socialive is an enterprise video platform that makes it refreshingly easy to capture, create, and distribute video.",15640,"Less than $1M","1/1/2014","year","Content and Publishing, Media and Entertainment, Sales and Marketing, Software, Video","1","11-50",1,1800000,"2","Private","NA","NA","NA","NA","Early Stage Venture","6/5/2014","1800000","Series A","NA","NA","NA"
"1149",0,1149,"Laylo","Music","Los Angeles, California, United States","A platform to connect artists with their best fans",27216,"NA","4/26/2017","day","Media and Entertainment, Music and Audio","1","1-10",1,1500000,"1","Private","NA","NA","NA","1","Seed","8/10/2019","1500000","Seed","0","2","NA"
"399",1,399,"Laurel & Wolf","E-Commerce, Fashion, Interior Design, Internet, Lifestyle, Marketplace","Los Angeles, California, United States","Laurel & Wolf is the leading online interior design marketplace. We make professional interior design affordable & accessible for everyone.",8818,"$1M to $10M","1/1/2014","year","Clothing and Apparel, Commerce and Shopping, Community and Lifestyle, Design, Internet Services, Real Estate","2","51-100",4,25500000,"14","Private","NA","NA","3","1","Early Stage Venture","9/2/2015","20000000","Series B","0","1","NA"
"1112",0,1112,"Nutrinsic","Food and Beverage, Food Delivery, Food Processing, Sustainability","Glendale, California, United States","Nutrinsic is a pioneer in providing commercial nutrition solutions through the upcycling of unused nutrients",26195,"$1M to $10M","1/1/2001","year","Food and Beverage, Sustainability, Transportation","1","11-50",9,38345000,"6","Private","NA","NA","NA","2","NA","8/6/2015","5610000","Venture - Series Unknown","1","2","NA"
"70",1,70,"Savage X Fenty","E-Commerce, Fashion, Retail","El Segundo, California, United States","Savage X Fenty is a lingerie brand company that offers a variety of underwear ranging from everyday basics to more provocative pieces.",1583,"$100M to $500M","1/1/2017","year","Clothing and Apparel, Commerce and Shopping, Design","3","NA",1,7e+07,"2","Private","NA","NA","NA","2","NA","8/27/2019","70000000","Venture - Series Unknown","NA","NA","NA"
"985",0,985,"Fluxergy","Biotechnology, Health Care, Medical","Irvine, California, United States","Fluxergy applies modular diagnostic technologies to provide accurate answers at the point-of-use.",23038,"Less than $1M","1/1/2013","year","Biotechnology, Health Care, Science and Engineering","2","51-100",1,4500000,"NA","Private","NA","NA","NA","NA","NA","4/1/2015","4500000","Venture - Series Unknown","8","2","NA"
"77",1,77,"PatientPop","Digital Marketing, Health Care, Internet, SaaS","Santa Monica, California, United States","PatientPop is the only complete practice growth solution that empowers healthcare providers to thrive in the digital age.",1794,"$1M to $10M","1/1/2014","year","Health Care, Internet Services, Sales and Marketing, Software","2","251-500",4,7.5e+07,"4","Private","NA","NA","NA","3","Early Stage Venture","10/31/2018","25000000","Series B","0","2","NA"
"1749",0,1749,"VivoAquatics","Consulting, Software","Monrovia, California, United States","Provides real-time water management and analytics through the VivoPoint SaaS application and related services.",43061,"NA","1/1/2009","year","Software","3","51-100",1,8e+06,"1","Private","NA","NA","NA","1","NA","1/10/2019","8000000","Venture - Series Unknown","0","7","NA"
