"","Y","id","Organization.Name","Industries","Headquarters.Location","Description","CB.Rank..Company.","Estimated.Revenue.Range","Founded.Date","Founded.Date.Precision","Industry.Groups","Number.of.Founders","Number.of.Employees","Number.of.Funding.Rounds","Total.Funding.Amount","Number.of.Investors","IPO.Status","IPO.Date","Acquisition.Status","Number.of.Events","Number.of.Lead.Investors","Funding.Status","Last.Funding.Date","Last.Funding.Amount.Currency..in.USD.","Last.Funding.Type","IPqwery...Total.Patents","IPqwery...Total.Trademarks","Investment.Stage"
"1650",0,1650,"MiCardia Corporation","Health Care, Medical, Medical Device","Irvine, California, United States","MiCardia is a privately held medical device company developing technology platforms to optimize mitral valve repair.",40438,"$1M to $10M","1/1/2004","year","Health Care","1","11-50",6,28926940,"4","Private","NA","NA","NA","NA","NA","4/5/2012","3696105","Debt Financing","8","4","NA"
"1676",0,1676,"Edesa Biotech","Biotechnology, Health Diagnostics, Pharmaceutical","Port Hueneme Cbc Base, California, United States","Edesa Biotech (formerly Stellar Biotechnologies) develops treatments for dermatological and anorectal diseases",40931,"Less than $1M","1/1/1999","year","Biotechnology, Health Care, Science and Engineering","1","11-50",7,29735580,"NA","Public","2010-06-25","Made Acquisitions","NA","NA","IPO","5/15/2018","5500000","Post-IPO Equity","NA","NA","NA"
"1539",0,1539,"Aloware","Call Center, Communications Infrastructure, CRM, Customer Service, SaaS, Telecommunications, Unified Communications","Los Angeles, California, United States","Omnichannel Cloud Contact Center that supports Calls, SMS, Social Messengers and works with any CRM.",37289,"NA","11/1/2017","month","Administrative Services, Hardware, Information Technology, Internet Services, Messaging and Telecommunications, Sales and Marketing, Software","2","11-50",1,250000,"NA","Private","NA","NA","1","NA","Seed","2/20/2018","250000","Seed","NA","NA","NA"
"805",0,805,"dataPlor","Big Data, Emerging Markets, Location Based Services","Los Angeles, California, United States","dataPlor connects global companies to micro-businesses in growing economies",18691,"$1M to $10M","1/1/2016","month","Data and Analytics, Internet Services, Navigation and Mapping","1","11-50",2,2765000,"5","Private","NA","NA","3","2","Seed","7/24/2019","2000000","Seed","NA","NA","NA"
"1843",0,1843,"Ingram Micro","Electronics, Information Technology, Logistics, Software, VoIP","Irvine, California, United States","Ingram Micro distributes information technology (IT) products and supply chain solutions worldwide.",45590,"NA","1/1/1979","year","Consumer Electronics, Hardware, Information Technology, Internet Services, Messaging and Telecommunications, Software, Transportation","1","10001+",NA,NA,"NA","Delisted","2013-03-08","Made Acquisitions, Was Acquired","43","NA","M&A",NA,"NA","NA","49","97","NA"
"876",0,876,"Boon","College Recruiting, Human Resources, Recruiting, Social Media, Social Recruiting","Los Angeles, California, United States","Game-changing referral engagement network",20364,"$1M to $10M","1/1/2016","year","Administrative Services, Education, Internet Services, Media and Entertainment, Professional Services","3","1-10",9,670304,"4","Private","NA","NA","4","NA","Seed","8/1/2018","NA","Non-equity Assistance","0","2","NA"
"1504",0,1504,"Leadr","Apps, Gamification, Messaging, Mobile, Mobile Apps, Photo Sharing, Social, Social Media, Social Network","Los Angeles, California, United States","The Game of Your Life.",36346,"NA","8/20/2017","day","Apps, Content and Publishing, Gaming, Information Technology, Internet Services, Media and Entertainment, Messaging and Telecommunications, Mobile, Software","1","1-10",1,1e+05,"NA","Private","NA","NA","NA","NA","Seed","8/8/2019","100000","Pre-Seed","0","1","NA"
"1880",0,1880,"Bloominous","E-Commerce, Events, Flowers, Wedding","Los Angeles, California, United States","Bloominous is a tech startup in the wedding floral space. ",46466,"Less than $1M","9/6/2013","day","Commerce and Shopping, Community and Lifestyle, Consumer Goods, Events, Media and Entertainment","2","11-50",3,450000,"2","Private","NA","NA","NA","1","Seed","2/4/2019","NA","Pre-Seed","0","2","NA"
"1364",0,1364,"ClutchPoints","Media and Entertainment, Sports","Los Angeles, California, United States","Unlock your sports world.",32943,"NA","6/1/2015","day","Media and Entertainment, Sports","1","11-50",1,5e+05,"NA","Private","NA","NA","NA","NA","Seed","3/1/2017","500000","Seed","NA","NA","NA"
"331",1,331,"DogVacay","Health Care, Marketplace, Peer to Peer, Pet","Santa Monica, California, United States","DogVacay is a pet boarding marketplace connecting pet owners with families willing to take care of their pets while they are away.",7415,"NA","12/22/2011","day","Commerce and Shopping, Community and Lifestyle, Health Care","1","101-250",5,4.7e+07,"19","Private","NA","Was Acquired","1","4","M&A","11/10/2014","25000000","Series B","0","5","NA"
"1023",0,1023,"Maverick","Digital Media, Events, Social Media","West Hollywood, California, United States","Maverick is a digital creator network for a new generation of innovators, artists, and entrepreneurs.",24117,"NA","9/1/2017","day","Events, Internet Services, Media and Entertainment","2","11-50",2,3395000,"6","Private","NA","NA","NA","NA","Seed","5/4/2018","695000","Seed","0","1","NA"
"1815",0,1815,"zEconomy","B2B, Marketplace, Payments","Culver City, California, United States","zEconomy is a liquidity marketplace that enables businesses to trade liquidity for price discounts, without increasing credit risk.",44887,"Less than $1M","1/1/2013","year","Commerce and Shopping, Financial Services, Payments","NA","1-10",1,1550000,"NA","Private","NA","NA","NA","NA","Seed","6/18/2014","1550000","Seed","0","1","NA"
"1615",0,1615,"AECOM","Civil Engineering, Construction, Consulting, Energy, Government, Information Technology","Los Angeles, California, United States","AECOM is a global provider of professional technical and management support services to a broad range of markets.",39459,"$1B to $10B","1/1/1990","year","Energy, Government and Military, Information Technology, Real Estate, Science and Engineering","1","10001+",NA,NA,"NA","Public","2007-05-18","Made Acquisitions","4","NA","IPO",NA,"NA","NA","23","71","NA"
"1830",0,1830,"Lootsie","Enterprise Software, Loyalty Programs","Culver City, California, United States","Lootsie is mobile-first customer loyalty.",45287,"NA","7/9/2012","day","Sales and Marketing, Software","2","11-50",4,6962500,"4","Private","NA","NA","NA","NA","Seed","12/21/2015","2212500","Debt Financing","0","1","NA"
"1980",0,1980,"Marina Biotech","Biotechnology, Health Care, Medical, Pharmaceutical","City Of Industry, California, United States","Patient Centric Care for Hypertension and Pain",49133,"Less than $1M","1/1/1983","year","Biotechnology, Health Care, Science and Engineering","NA","11-50",6,19900000,"2","Public","2003-01-10","Made Acquisitions","NA","NA","IPO","7/25/2018","1500000","Post-IPO Equity","NA","NA","NA"
"133",1,133,"Aspiration","Banking, Financial Services, FinTech, Sustainability","Marina Del Rey, California, United States","Aspiration is a financial firm with a conscience that is built for everyone, committed to giving and founded on trust.",2871,"$1M to $10M","1/1/2013","year","Financial Services, Lending and Investments, Sustainability","2","101-250",3,6.5e+07,"32","Private","NA","NA","NA","2","Early Stage Venture","12/7/2017","47000000","Series B","1","56","NA"
"977",0,977,"FairClaims","Enterprise, Legal, SaaS, Service Industry","Los Angeles, California, United States","FairClaims is an online dispute resolution platform for enterprise.",22830,"NA","7/1/2014","month","Professional Services, Software","2","11-50",4,2360000,"12","Private","NA","NA","NA","1","Seed","8/20/2018","NA","Seed","1","6","NA"
"1591",0,1591,"AIR.TV","Advertising, Content Syndication","Culver City, California, United States","AIR.TV enables the distribution and monetization of viral videos on websites.",38891,"NA","1/1/2014","year","Advertising, Content and Publishing, Media and Entertainment, Sales and Marketing","2","11-50",3,6220000,"11","Private","NA","NA","NA","1","Early Stage Venture","4/28/2015","3320000","Series A","NA","NA","NA"
"1837",0,1837,"Nannocare","Consumer Goods, Women's","Los Angeles, California, United States","Nannocare is an all-natural and hypoallergenic pad made with USDA, OCS- certified organic cotton.",45492,"NA","1/1/2017","year","Consumer Goods","NA","NA",2,297614,"1","Private","NA","NA","NA","NA","NA","12/18/2019","47614","Equity Crowdfunding","0","4","NA"
"655",0,655,"Moving Analytics","Health Care, Information Technology","Los Angeles, California, United States","Moving Analytics provides Movn - a digital rehabilitation program for heart disease.",14636,"Less than $1M","1/1/2013","year","Health Care, Information Technology","5","11-50",8,5515000,"7","Private","NA","NA","1","1","Seed","4/26/2019","3000000","Seed","NA","NA","NA"
"1497",0,1497,"Prime Lightworks","Electronics, Manufacturing, Satellite Communication","Culver City, California, United States","Prime Lightworks Inc. manufactures electric propulsion systems for space satellites.",36245,"NA","1/1/2015","year","Consumer Electronics, Hardware, Manufacturing","2","NA",2,120000,"2","Private","NA","NA","1","NA","NA","2/25/2020","NA","Equity Crowdfunding","1","3","NA"
"18",1,18,"Grindr","Apps, iOS, LGBT, Location Based Services, Social Media, Social Network","West Hollywood, California, United States","Grindr is a location-based social application for gay, bi, trans, queer people and other members of the LGBT community.",276,"$10M to $50M","2/3/2008","day","Apps, Data and Analytics, Internet Services, Media and Entertainment, Mobile, Navigation and Mapping, Platforms, Software","2","51-100",1,9.3e+07,"NA","Private","NA","Was Acquired","4","NA","M&A","1/11/2016","93000000","Private Equity","5","13","NA"
"1373",0,1373,"ServiceMesh","Automotive, Cloud Computing, Cloud Management, Enterprise Software, SaaS, Software","Santa Monica, California, United States","ServiceMesh provides an enterprise cloud management platform that enables on-demand, self-service IT operating models.",33163,"NA","1/1/2008","year","Information Technology, Internet Services, Software, Transportation","2","101-250",2,1.5e+07,"4","Private","NA","Was Acquired","NA","1","M&A","7/31/2013","NA","Venture - Series Unknown","3","7","NA"
"1689",0,1689,"Flint Rehab","Medical Device","Irvine, California, United States","Flint Rehab is an Irvine, CA-based neuro-rehabilitation device company.",41276,"NA","1/1/2001","year","Health Care","1","NA",1,1720000,"1","Private","NA","NA","NA","1","NA","3/13/2019","1720000","Grant","4","8","NA"
"1589",0,1589,"Inserviss Marketplace","Beauty, Education, Marketplace, Mobile","Los Angeles, California, United States","Inserviss Marketplace is The Mobile & Blockchain Start up Company.",38802,"NA","1/15/2018","day","Commerce and Shopping, Consumer Goods, Education, Mobile","2","11-50",1,1e+06,"1","Private","NA","NA","NA","1","Seed","12/5/2019","1000000","Seed","NA","NA","NA"
"684",0,684,"indie Semiconductor","Semiconductor","Aliso Viejo, California, United States","Axiom successfully built the world’s first CMOS power amp for the cellphone market and shipped 250M units. ",15406,"NA","1/1/2007","year","Hardware, Science and Engineering","NA","51-100",3,32500075,"NA","Private","NA","NA","NA","NA","NA","7/16/2018","22000000","Venture - Series Unknown","NA","NA","NA"
"1355",0,1355,"WiSpry","Electronics, Infrastructure, Manufacturing, Mobile, Semiconductor, Wireless","Irvine, California, United States","WiSpry, a fabless semiconductor company, develops RF silicon integrated circuits and components for wireless communication products.",32647,"NA","1/1/2002","year","Consumer Electronics, Hardware, Manufacturing, Mobile, Science and Engineering","1","11-50",11,63299998,"13","Private","NA","Was Acquired","1","3","M&A","7/11/2014","7999999","Venture - Series Unknown","78","4","NA"
"485",0,485,"Pearl","Artificial Intelligence, Computer Vision, Dental, Health Care, Image Recognition, Software","West Hollywood, California, United States","Pearl is a computer vision company focusing on solving challenging problems in the dental industry.",10797,"NA","4/30/2019","day","Artificial Intelligence, Data and Analytics, Hardware, Health Care, Science and Engineering, Software","2","11-50",1,1.1e+07,"2","Private","NA","NA","NA","1","Early Stage Venture","5/8/2019","11000000","Series A","0","5","NA"
"350",1,350,"Metropolis","Internet","Los Angeles, California, United States","Stealth start-up based in Los Angeles.",7812,"NA","1/1/2017","year","Internet Services","1","11-50",1,17500000,"3","Private","NA","NA","NA","1","Seed","6/26/2019","17500000","Seed","NA","NA","NA"
"1636",0,1636,"Poptent","Advertising, Brand Marketing, Content, Photography, Project Management, Video","San Clemente, California, United States","Poptent is a social video marketing platform that supports videographers to create and manage video projects from start to finish.",40060,"$10M to $50M","3/1/2007","day","Advertising, Content and Publishing, Media and Entertainment, Sales and Marketing, Video","1","1-10",3,15282497,"1","Private","NA","NA","NA","1","NA","7/12/2012","5500000","Venture - Series Unknown","NA","NA","NA"
"991",0,991,"Wiredrive","Asset Management, Cloud Computing, Collaboration, Digital Media, File Sharing, Media and Entertainment, SaaS, Video","Los Angeles, California, United States","Wiredrive is a secure media sharing and collaboration service for marketing teams, agencies, and production companies.",23150,"NA","1/1/2000","year","Financial Services, Internet Services, Media and Entertainment, Software, Video","3","51-100",1,5e+06,"1","Private","NA","Was Acquired","NA","1","M&A","5/19/2015","5000000","Debt Financing","0","4","NA"
"420",1,420,"Swell","Financial Services, FinTech, Impact Investing, Mobile Apps, Social Impact, Trading Platform","Santa Monica, California, United States","Swell is an impact investing platform that aims to deliver profit as well as purpose.",9278,"$1M to $10M","1/15/2015","day","Apps, Financial Services, Lending and Investments, Mobile, Software","1","11-50",1,3e+07,"1","Private","NA","NA","NA","1","NA","2/1/2018","30000000","Venture - Series Unknown","0","20","NA"
"917",0,917,"Tiltify","Crowdfunding","West Hollywood, California, United States","Tiltify is first crowdfunding site designed to turn your livestreams into a charity fundraiser.",21528,"$1M to $10M","1/1/2013","year","Financial Services","1","NA",1,999996,"NA","Private","NA","NA","4","NA","Seed","11/22/2017","999996","Seed","NA","NA","NA"
"1886",0,1886,"DoubleCheck Solutions","B2B, Banking, Financial Services, FinTech, Real Time","Los Angeles, California, United States","Delivering a New Dimension of Banking",46571,"$1M to $10M","1/1/2013","year","Financial Services, Lending and Investments","2","1-10",1,3233004,"NA","Private","NA","NA","NA","NA","NA","6/3/2014","3233004","Venture - Series Unknown","NA","NA","NA"
"1292",0,1292,"Push Health","Health Care, Medical, Wellness","El Segundo, California, United States","Push Health was founded with a simple idea: every medical provider should be able to care for his or her network using great technology",30847,"Less than $1M","1/1/2012","year","Health Care","1","1-10",1,308009,"NA","Private","NA","NA","NA","NA","NA","3/11/2014","308009","Venture - Series Unknown","NA","NA","NA"
"1851",0,1851,"Brud","Apps, Artificial Intelligence, Robotics","Los Angeles, California, United States","Brud is a group of problem solvers specializing in robotics, artificial intelligence, and their applications to media businesses. ",45820,"NA","1/1/2014","year","Apps, Artificial Intelligence, Data and Analytics, Hardware, Science and Engineering, Software","2","NA",3,6100000,"7","Private","NA","NA","NA","4","Early Stage Venture","1/14/2019","NA","Series B","0","7","NA"
"1209",0,1209,"Hush","E-Commerce, iOS, Mobile Apps, Retail, Shopping","Los Angeles, California, United States","Discover, share, and shop for beauty products on Hush. ",28800,"NA","1/1/2016","year","Apps, Commerce and Shopping, Mobile, Platforms, Software","3","1-10",3,120000,"3","Private","NA","NA","1","1","Early Stage Venture","6/1/2017","NA","Series A","0","2","NA"
"1507",0,1507,"Raya","Communities, Mobile Apps, Social Network","Los Angeles, California, United States","Raya is an online membership-based community for dating, networking, and making new friends.",36459,"NA","3/1/2015","month","Apps, Community and Lifestyle, Internet Services, Mobile, Software","1","NA",1,NA,"1","Private","NA","NA","NA","NA","Seed","12/22/2016","NA","Seed","0","5","NA"
"880",0,880,"friendbuy","Digital Marketing, E-Commerce, Enterprise Software, Retail Technology, SaaS","Los Angeles, California, United States","Powering referral marketing for the hottest companies in e-commerce.",20418,"NA","1/1/2010","year","Commerce and Shopping, Hardware, Sales and Marketing, Software","1","11-50",2,1800000,"5","Private","NA","NA","NA","NA","Seed","2/16/2018","500000","Debt Financing","0","1","NA"
"1972",0,1972,"JetHunter","B2B, Business Information Systems, CRM, Enterprise Software, Transaction Processing, Travel","Irvine, California, United States","Global Distribution System for private jet market",48909,"NA","1/1/2014","year","Financial Services, Information Technology, Payments, Sales and Marketing, Software, Travel and Tourism","1","1-10",4,270000,"4","Private","NA","NA","2","NA","Private Equity","4/1/2016","200000","Convertible Note","NA","NA","NA"
"869",0,869,"FameBit","Advertising, Marketing, Social Network","Santa Monica, California, United States","Fame Bit is a YouTube marketing platform where brands collaborate with YouTube influencers and create videos.",20267,"NA","1/1/2013","year","Advertising, Internet Services, Sales and Marketing","2","11-50",2,1500000,"6","Private","NA","Made Acquisitions, Was Acquired","7","NA","M&A","6/20/2014","1500000","Seed","NA","NA","NA"
"1900",0,1900,"Aviir","Biotechnology, Health Diagnostics, Pharmaceutical","Irvine, California, United States","Aviir provides cardio metabolic tests and services for the prevention and management of cardiovascular diseases.",46973,"NA","1/1/2005","year","Biotechnology, Health Care, Science and Engineering","NA","51-100",14,70940000,"5","Private","NA","NA","NA","1","Early Stage Venture","6/21/2013","10000000","Series B","1","2","NA"
"1694",0,1694,"iGo","Electronics, Mobile, Software","Irvine, California, United States","A leading supplier of charging technology for the mobile consumer electronics industry.",41640,"$10M to $50M","1/1/1993","year","Consumer Electronics, Hardware, Mobile, Software","2","51-100",1,3e+07,"NA","Public","2000-07-06","Made Acquisitions","NA","NA","IPO","6/9/2014","30000000","Venture - Series Unknown","NA","NA","NA"
"451",1,451,"Knowable Universe","Software","Los Angeles, California, United States","Knowable Universe is an audio learning platform",9954,"NA","1/1/2013","year","Software","NA","NA",1,4e+06,"4","Private","NA","NA","NA","1","Seed","10/1/2019","4000000","Seed","0","1","NA"
"1253",0,1253,"Simmer","Consumer Reviews, Food and Beverage, Mobile Apps, Restaurants","Tustin, California, United States","Simmer is a food review app that aims to bring high quality reviews for every dish on the menu.",29709,"NA","1/1/2018","year","Apps, Commerce and Shopping, Food and Beverage, Mobile, Software","2","1-10",1,150000,"2","Private","NA","NA","NA","1","Seed","8/19/2019","150000","Seed","NA","NA","NA"
"178",1,178,"Appetize","Apps, Events, Information Technology, Mobile, Software","Los Angeles, California, United States","Appetize develops point-of-sale and payment systems for entertainment, leisure and education enterprise businesses around the world.",4107,"$1M to $10M","9/1/2011","month","Apps, Events, Information Technology, Media and Entertainment, Mobile, Software","3","251-500",6,77387354,"6","Private","NA","NA","NA","2","Early Stage Venture","8/9/2018","10000000","Series B","0","4","NA"
"290",1,290,"Genies","Media and Entertainment, Mobile, Mobile Apps","Venice, California, United States","Genies is a mobile app company that allows users to clone themselves.",6561,"$50M to $100M","4/1/2013","day","Apps, Media and Entertainment, Mobile, Software","3","11-50",9,38800000,"41","Private","NA","NA","NA","3","NA","6/11/2019","15000000","Venture - Series Unknown","3","2","NA"
"1271",0,1271,"Big Frame","Advertising","Culver City, California, United States","Big Frame is a collection of online resources. Learn about various subjects, get inspired and improve your life and your business.",30183,"NA","1/1/2011","year","Advertising, Sales and Marketing","5","1-10",2,3425000,"12","Private","NA","Was Acquired","NA","NA","M&A","6/27/2012","3400000","Seed","NA","NA","NA"
"1916",0,1916,"Ziptask","Consulting, Finance, FinTech, Outsourcing, Software","Anaheim, California, United States","Ziptask is an online outsourcing services platform that employs project managers to execute the projects of consumers and SMEs.",47623,"NA","11/1/2011","day","Financial Services, Professional Services, Software","2","11-50",3,118000,"5","Private","NA","NA","NA","NA","Seed","5/4/2015","NA","Seed","NA","NA","NA"
"893",0,893,"One Step Software","Real Estate, Rehabilitation, Software, Wellness","Los Angeles, California, United States","One Step is a fast growing technology company in the sober living space.",20892,"NA","6/1/2017","day","Health Care, Real Estate, Software","1","1-10",3,1100000,"12","Private","NA","NA","NA","NA","Seed","7/1/2018","1000000","Seed","0","7","NA"
"458",0,458,"Dash Radio","Broadcasting, Digital Media, Music","Los Angeles, California, United States","Dash Radio is an all original radio broadcaster for the digital world.",10176,"$1M to $10M","6/15/2015","day","Media and Entertainment, Music and Audio, Video","3","11-50",2,8800000,"19","Private","NA","NA","NA","NA","Seed","10/24/2018","8800000","Seed","1","1","NA"
"1120",0,1120,"Willdan","Business Information Systems, Civil Engineering, Consulting, Management Consulting, Technical Support","Anaheim, California, United States","Willdan is a company selling professional technical and consulting services to public agencies at all levels.",26342,"$100M to $500M","1/1/1964","year","Information Technology, Professional Services, Science and Engineering","NA","501-1000",3,41600000,"2","Public","2006-11-21","Made Acquisitions","NA","1","IPO","12/15/2017","6300000","Grant","0","8","NA"
"1428",0,1428,"HouseStay","E-Commerce, Real Estate, Travel","Los Angeles, California, United States","Housestay.com is an online marketplace for fully furnished standalone home and apartment rentals with a minimum stay of 30 Days.",34459,"$1M to $10M","2/15/2017","day","Commerce and Shopping, Real Estate, Travel and Tourism","2","1-10",2,5e+05,"NA","Private","NA","NA","NA","NA","Seed","5/8/2019","500000","Convertible Note","0","1","NA"
"364",1,364,"BURST Oral Care","Dental, Health Care","Walnut, California, United States","BURST is the most affordable, subscription oral care company recommended to you by your most trusted dental professional.",8111,"NA","1/1/2017","year","Health Care","2","NA",1,2e+07,"1","Private","NA","NA","NA","1","NA","10/28/2019","20000000","Venture - Series Unknown","NA","NA","NA"
"1266",0,1266,"Stir","Consumer Electronics, Fitness, Internet of Things, Wellness","Pasadena, California, United States","Stir is a developer of smart kinetic desks for homes and commercial entities.",30122,"$1M to $10M","6/1/2012","day","Consumer Electronics, Hardware, Health Care, Internet Services, Sports","1","11-50",1,1500000,"5","Private","NA","NA","NA","1","Seed","3/20/2014","1500000","Seed","0","4","NA"
"1126",0,1126,"Avenu Medical","Health Care, Medical, Medical Device","San Juan Capistrano, California, United States","Avenu Medical is a well-established medical device company dedicated to creating paradigm shift in vascular access for hemodialysis patient.",26547,"$1M to $10M","1/1/2010","year","Health Care","2","NA",5,31395000,"NA","Private","NA","NA","NA","NA","NA","10/31/2018","12000000","Venture - Series Unknown","34","8","NA"
"206",1,206,"Within (VR/AR)","Apps, Augmented Reality, Software, Virtual Reality","Los Angeles, California, United States","Within is a virtual reality and augmented reality media and technology company.",4677,"$1M to $10M","12/1/2014","month","Apps, Hardware, Software","2","51-100",3,52600000,"18","Private","NA","NA","NA","4","Early Stage Venture","7/26/2017","40000000","Series B","0","23","NA"
"44",1,44,"GumGum","Advertising, Advertising Platforms, Analytics, Artificial Intelligence, Brand Marketing, Computer Vision, Digital Media, Image Recognition, Natural Language Processing, Sports","Santa Monica, California, United States","GumGum is an artificial intelligence company focusing on computer vision and natural language processing.",949,"$1M to $10M","1/1/2008","year","Advertising, Artificial Intelligence, Data and Analytics, Hardware, Media and Entertainment, Sales and Marketing, Science and Engineering, Software, Sports","2","251-500",6,58825000,"7","Private","NA","NA","13","5","Late Stage Venture","2/13/2020","22000000","Series D","18","8","NA"
"1477",0,1477,"Tapin2","Hospitality, Mobile, Music Venues, Software, Sports, Vending and Concessions","Pasadena, California, United States","Tapin2 is a software platform that enables mobile ordering and self-service ordering for hospitality and live events.",35632,"Less than $1M","9/1/2014","month","Commerce and Shopping, Media and Entertainment, Mobile, Software, Sports, Travel and Tourism","3","1-10",4,1840000,"NA","Private","NA","NA","NA","NA","Seed","7/1/2016","980000","Seed","0","2","NA"
